{
  "protocol_version": "0.1",
  "evidence_channels": ["agent", "runtime"],
  "run_id": "agent-001",
  "status": "awaiting_llm_responses",
  "project": {
    "root": "/workspace/example-project",
    "source_locale": "en-US",
    "target_locale": "zh-CN",
    "mode": "standard_project",
    "operating_mode": "greenfield_localization",
    "reference_policy": "style_only"
  },
  "agent": {
    "architecture": "routing_parallelization_reflection",
    "provider_mode": "human_assisted_host_llm",
    "direct_model_api": false,
    "phases": ["routing", "parallelization", "reflection"]
  },
  "routing": {
    "status": "pass",
    "supported_file_count": 1,
    "adapter_counts": { "core.android-strings": 1 },
    "selected_source_files": ["app/src/main/res/values/strings.xml"],
    "ignored_path_count": 2
  },
  "parallelization": {
    "status": "handoff_ready",
    "segment_count": 10,
    "batch_count": 1
  },
  "reflection": {
    "status": "pending_llm_output",
    "delivery_decision_status": null,
    "requires_user_confirmation_before_apply": true
  },
  "delivery": {
    "status": "pending_generation",
    "decision_status": null,
    "decision_report": null,
    "decision_markdown": null,
    "apply_plan": null,
    "requires_user_confirmation_before_apply": false
  },
  "runs": {
    "handoff": {
      "run_id": "agent-001",
      "status": "handoff_ready",
      "run_directory": "localize-anything-output/agent-001",
      "summary": { "batch_count": 1 }
    },
    "delivery": null
  },
  "summary": {
    "source_file_count": 1,
    "segment_count": 10,
    "batch_count": 1,
    "output_count": 0,
    "qa_status": "not_checked",
    "blocking_count": 0,
    "warning_count": 0
  },
  "artifacts": {
    "run_directory": "localize-anything-output/agent-001",
    "agent_summary": "localize-anything-output/agent-001/agent-summary.json",
    "session_index": ".localize-anything/sessions/index.json"
  },
  "next_actions": ["Save one response per batch, then rerun agent-run with --responses-dir."]
}
